{
  "$schema": "../../schemas/v1/unit.schema.json",
  "game_version": "0.0.1",
  "entity_id": "dryad",
  "name": "Dryad",
  "category": "Creature",
  "health": 225,
  "damage": 12,
  "attack_speed": 1.0,
  "movement_speed": 3,
  "range": 1,
  "movement_type": "Ground",
  "tags": [],
  "description": "Support creature that heals allies. Uses elemental attacks when infused"
}