{
  "$schema": "../../schemas/v1/unit.schema.json",
  "game_version": "0.0.1",
  "entity_id": "gaia_beast",
  "name": "Gaia Beast",
  "category": "Titan",
  "health": 1000,
  "damage": 80,
  "attack_speed": 1.0,
  "movement_speed": 4,
  "range": 1,
  "movement_type": "Ground",
  "tags": [],
  "description": "The Wild Titan. Crushes all structures as it marches toward the Lifestones."
}