{
  "$schema": "../../schemas/v1/unit.schema.json",
  "game_version": "0.0.1",
  "entity_id": "thanatos",
  "name": "Thanatos",
  "category": "Titan",
  "health": 1000,
  "damage": 40,
  "attack_speed": 1.0,
  "movement_speed": 4,
  "range": 1,
  "movement_type": "Ground",
  "tags": [],
  "description": "The Titan of Death inflict curses to enemies, increasing the damage they take and reducing their movement speed."
}