{
  "$schema": "../../schemas/v1/unit.schema.json",
  "game_version": "0.0.1",
  "entity_id": "faerie",
  "name": "Faerie",
  "category": "Creature",
  "health": 100,
  "damage": 9,
  "attack_speed": 1.0,
  "movement_speed": 3,
  "range": 1,
  "movement_type": "Ground",
  "tags": [],
  "description": "Stealthy flying ranged creature that turns invisible out of combat"
}