[
  {
    "$schema": "../../schemas/v1/unit.schema.json",
    "game_version": "0.0.1",
    "entity_id": "dryad",
    "name": "Dryad",
    "category": "Creature",
    "health": 225,
    "damage": 12,
    "attack_speed": 1.0,
    "movement_speed": 3,
    "range": 1,
    "movement_type": "Ground",
    "tags": [],
    "description": "Support creature that heals allies. Uses elemental attacks when infused"
  },
  {
    "$schema": "../../schemas/v1/unit.schema.json",
    "game_version": "0.0.1",
    "entity_id": "earthquake",
    "name": "Earthquake",
    "category": "Spell",
    "health": 0,
    "damage": 150,
    "attack_speed": 1.0,
    "movement_speed": 3,
    "range": 1,
    "movement_type": "Ground",
    "tags": [
      "Earth",
      "damage",
      "slow"
    ],
    "description": "Shakes the ground, dealing damage and slowing enemies in a large area."
  },
  {
    "$schema": "../../schemas/v1/unit.schema.json",
    "game_version": "0.0.1",
    "entity_id": "earth_golem",
    "name": "EARTH GOLEM",
    "category": "Creature",
    "health": 650,
    "damage": 25,
    "attack_speed": 1.0,
    "movement_speed": 2,
    "range": 1,
    "movement_type": "Ground",
    "tags": [],
    "description": "Strong melee unit that resists damage from large enemies"
  },
  {
    "$schema": "../../schemas/v1/unit.schema.json",
    "game_version": "0.0.1",
    "entity_id": "faerie",
    "name": "Faerie",
    "category": "Creature",
    "health": 100,
    "damage": 9,
    "attack_speed": 1.0,
    "movement_speed": 3,
    "range": 1,
    "movement_type": "Ground",
    "tags": [],
    "description": "Stealthy flying ranged creature that turns invisible out of combat"
  },
  {
    "$schema": "../../schemas/v1/unit.schema.json",
    "game_version": "0.0.1",
    "entity_id": "gaia_beast",
    "name": "Gaia Beast",
    "category": "Titan",
    "health": 1000,
    "damage": 80,
    "attack_speed": 1.0,
    "movement_speed": 4,
    "range": 1,
    "movement_type": "Ground",
    "tags": [],
    "description": "The Wild Titan. Crushes all structures as it marches toward the Lifestones."
  },
  {
    "$schema": "../../schemas/v1/unit.schema.json",
    "game_version": "0.0.1",
    "entity_id": "giant_shielder",
    "name": "Giant Shielder",
    "category": "Creature",
    "health": 150,
    "damage": 30,
    "attack_speed": 1.0,
    "movement_speed": 3,
    "range": 1,
    "movement_type": "Ground",
    "tags": [],
    "description": "Slow giant that protects allies with a massive shield"
  },
  {
    "$schema": "../../schemas/v1/unit.schema.json",
    "game_version": "0.0.1",
    "entity_id": "harpy",
    "name": "HARPY",
    "category": "Creature",
    "health": 100,
    "damage": 12,
    "attack_speed": 1.0,
    "movement_speed": 8,
    "range": 1,
    "movement_type": "Ground",
    "tags": [],
    "description": "Agile flying creature that excels at defeating ground units"
  },
  {
    "$schema": "../../schemas/v1/unit.schema.json",
    "game_version": "0.0.1",
    "entity_id": "harpy_nest",
    "name": "Harpy Nest",
    "category": "Building",
    "health": 1500,
    "damage": 0,
    "attack_speed": 1.0,
    "movement_speed": 3,
    "range": 1,
    "movement_type": "Ground",
    "tags": [
      "military"
    ],
    "description": "A high crag where harpies roost and train.",
    "collision_radius": 2
  },
  {
    "$schema": "../../schemas/v1/unit.schema.json",
    "game_version": "0.0.1",
    "entity_id": "juggernaut",
    "name": "Juggernaut",
    "category": "Creature",
    "health": 100,
    "damage": 50,
    "attack_speed": 1.0,
    "movement_speed": 3,
    "range": 1,
    "movement_type": "Ground",
    "tags": [],
    "description": "Colossal creature that deals massive damage to structures"
  },
  {
    "$schema": "../../schemas/v1/unit.schema.json",
    "game_version": "0.0.1",
    "entity_id": "lich",
    "name": "Lich",
    "category": "Creature",
    "health": 500,
    "damage": 5,
    "attack_speed": 1.0,
    "movement_speed": 5,
    "range": 1,
    "movement_type": "Ground",
    "tags": [],
    "description": "Undead caster that inflict curses to enemies, increasing the damage they take and reducing their movement speed."
  },
  {
    "$schema": "../../schemas/v1/unit.schema.json",
    "game_version": "0.0.1",
    "entity_id": "lizard_archer",
    "name": "Lizard Archer",
    "category": "Creature",
    "health": 85,
    "damage": 8,
    "attack_speed": 1.0,
    "movement_speed": 3,
    "range": 1,
    "movement_type": "Ground",
    "tags": [],
    "description": "Long-range fighter that deals bonus damage to flying enemies"
  },
  {
    "$schema": "../../schemas/v1/unit.schema.json",
    "game_version": "0.0.1",
    "entity_id": "ogre",
    "name": "Ogre",
    "category": "Creature",
    "health": 230,
    "damage": 70,
    "attack_speed": 1.0,
    "movement_speed": 3,
    "range": 1,
    "movement_type": "Ground",
    "tags": [],
    "description": "Mighty warrior that crushes target areas with a hammer"
  },
  {
    "$schema": "../../schemas/v1/unit.schema.json",
    "game_version": "0.0.1",
    "entity_id": "rocket_soldier",
    "name": "Rocket Soldier",
    "category": "Creature",
    "health": 220,
    "damage": 10,
    "attack_speed": 1.0,
    "movement_speed": 4,
    "range": 1,
    "movement_type": "Ground",
    "tags": [],
    "description": "Medium-range soldier that deals bonus damage to buildings"
  },
  {
    "$schema": "../../schemas/v1/unit.schema.json",
    "game_version": "0.0.1",
    "entity_id": "ruin_spider",
    "name": "RUIN SPIDER",
    "category": "Creature",
    "health": 85,
    "damage": 20,
    "attack_speed": 1.0,
    "movement_speed": 7,
    "range": 1,
    "movement_type": "Ground",
    "tags": [],
    "description": "Fast creature that explodes on contact, dealing bonus damage to buildings"
  },
  {
    "$schema": "../../schemas/v1/unit.schema.json",
    "game_version": "0.0.1",
    "entity_id": "skeleton_warrior",
    "name": "SKELETON WARRIOR",
    "category": "Creature",
    "health": 200,
    "damage": 15,
    "attack_speed": 1.0,
    "movement_speed": 3,
    "range": 1,
    "movement_type": "Ground",
    "tags": [],
    "description": "Undead soldier that captures altars quickly in large groups"
  },
  {
    "$schema": "../../schemas/v1/unit.schema.json",
    "game_version": "0.0.1",
    "entity_id": "stone_behemoth",
    "name": "STONE BEHEMOTH",
    "category": "Creature",
    "health": 210,
    "damage": 40,
    "attack_speed": 1.0,
    "movement_speed": 2,
    "range": 1,
    "movement_type": "Ground",
    "tags": [],
    "description": "Siege unit that hurls long-range boulders for heavy area damage"
  },
  {
    "$schema": "../../schemas/v1/unit.schema.json",
    "game_version": "0.0.1",
    "entity_id": "thanatos",
    "name": "THANATOS",
    "category": "Titan",
    "health": 1000,
    "damage": 40,
    "attack_speed": 1.0,
    "movement_speed": 4,
    "range": 1,
    "movement_type": "Ground",
    "tags": [],
    "description": "The Titan of Death inflict curses to enemies, increasing the damage they take and reducing their movement speed."
  },
  {
    "$schema": "../../schemas/v1/unit.schema.json",
    "game_version": "0.0.1",
    "entity_id": "wolven_hunter",
    "name": "Wolven Hunter",
    "category": "Creature",
    "health": 340,
    "damage": 16,
    "attack_speed": 1.0,
    "movement_speed": 3,
    "range": 1,
    "movement_type": "Ground",
    "tags": [],
    "description": "Hunter unit that fires powerful long-range bolts"
  },
  {
    "$schema": "../../schemas/v1/unit.schema.json",
    "game_version": "0.0.1",
    "entity_id": "wyvern",
    "name": "WYVERN",
    "category": "Creature",
    "health": 220,
    "damage": 19,
    "attack_speed": 1.0,
    "movement_speed": 7,
    "range": 1,
    "movement_type": "Ground",
    "tags": [],
    "description": "Flying dragonkin that attacks with mid-range projectiles"
  }
]