{
  "$schema": "../../schemas/v1/unit.schema.json",
  "game_version": "0.0.1",
  "entity_id": "rocket_soldier",
  "name": "Rocket Soldier",
  "category": "Creature",
  "health": 220,
  "damage": 10,
  "attack_speed": 1.0,
  "movement_speed": 4,
  "range": 1,
  "movement_type": "Ground",
  "tags": [],
  "description": "Medium-range soldier that deals bonus damage to buildings"
}